"first_author","source_name","url","remarks","source_type","estimate_grade","country","state","city","study_inclusion_criteria","study_exclusion_criteria","sex","sampling_start_date","sampling_end_date","population_group","age","denominator_value","serum_pos_prevalence","seroprev_95_ci_lower","seroprev_95_ci_upper","sampling_method","test_name","test_manufacturer","test_type","isotypes","antibody_target","test_validation","sensitivity","specificity"
"Alexandra Rouquette","Comparison of Depression and Anxiety Following Self-reported COVID-19-Like Symptoms vs SARS-CoV-2 Seropositivity in France","https://dx.doi.org/10.1001/jamanetworkopen.2023.12892","Included","Journal Article (Peer-Reviewed)","National","France",NA,NA,"On May 2, 2020, a letter was sent to a random sample of 371 000 people 15 years or older drawn from the national administrative and tax database (covering 96.4% of the population in France), with an intentional overrepresentation of individuals living in a household below the poverty level.","Individuals living in a residential care home for the elderly or in prison were excluded.

Of 85 074 individuals 15 years or older who completed the questionnaires at the 3 collection times, 28 568 were excluded because they did not return a blood sample for serologic testing, 1994 because of missing data on outcomes or exposures, and 9252 to respect the temporal sequence (exposure must precede the outcome).","All","2020-10-26","2020-12-14","Household and community samples","Multiple groups",45260,0.094,0.091,0.098,"Stratified probability","Anti-SARS-CoV-2 ELISA IgG","EUROIMMUN","ELISA","IgG","Spike","Validated by independent authors/third party/non-developers",0.864,0.962
"Ana Basto-Abreu","Nationally representative SARS-CoV-2 antibody prevalence estimates after the first epidemic wave in Mexico.","https://dx.doi.org/10.1038/s41467-022-28232-9","Included","Journal Article (Peer-Reviewed)","National","Mexico",NA,NA,"10,216 households were selected. At
each household, an adult family member was asked to respond to a household
questionnaire and a questionnaire on the use of health services and health status of
each family member.",NA,"All","2020-08-15","2020-11-15","Household and community samples","Multiple groups",9463,0.249,0.222,0.267,"Stratified probability","Elecsys® Anti‐SARS‐CoV‐2 (N)","Roche Diagnostics","CLIA","IgG","Nucleocapsid(N-protein)","Validated by independent authors/third party/non-developers",0.9202,0.9952
"Ana M. B. Menezes","High prevalence of symptoms among Brazilian subjects with antibodies against SARS-CoV-2.","https://dx.doi.org/10.1038/s41598-021-92775-y","Included","Journal Article (Peer-Reviewed)","National","Brazil",NA,NA,"Individuals living in the 133 sentinel cities of Brazil","Previous diagnosis of COVID-19, those with missing information on symptoms, or those with symptoms.","All","2020-06-21","2020-06-24","Household and community samples","Multiple groups",31869,0.027,NA,NA,"Stratified probability","Finecare SARS-CoV-2 Antibody test","Guangzhou Wondfo Biotech Co. Ltd","LFIA","['IgG', 'IgM']",NA,"Validated by independent authors/third party/non-developers",0.848,0.9995
"Beatriz Perez-Gomez","SARS-CoV-2 Infection During the First and Second Pandemic Waves in Spain: the ENE-COVID Study","https://dx.doi.org/10.2105/AJPH.2023.307233","Included","Journal Article (Peer-Reviewed)","National","Spain",NA,NA,"None listed - sounds like everyone sampled was eligible?","None listed","All","2020-04-27","2020-06-22","Household and community samples","Multiple groups",68287,0.06,0.057,0.064,"Stratified probability","COVID-19 IgG/IgM Rapid Test","Zhejiang Orient Gene Biotech","LFIA","IgG","Spike","Validated by independent authors/third party/non-developers",0.82,1
"Bela Merkely","Novel coronavirus epidemic in the Hungarian population, a cross-sectional nationwide survey to support the exit policy in Hungary","https://dx.doi.org/10.1007/s11357-020-00226-9","Included","Journal Article (Peer-Reviewed)","National","Hungary",NA,NA,"The target population included individuals aged
14 years or older, living in private households in Hungary. Note* ""For serological testing, blood samples were obtained from all participants at the age of 18 or older; under 18 years of age, blood testing was optional""",NA,"All","2020-05-01","2020-05-16","Household and community samples","Multiple groups",10474,0.0068,0.005,0.0086,"Stratified probability","Abbott Architect SARS-CoV-2 IgG","Abbott Laboratories","CLIA","IgG","Nucleocapsid(N-protein)","Validated by independent authors/third party/non-developers",NA,NA
"Cheikh Talla","Seroprevalence of anti-SARS-CoV-2 antibodies in Senegal: a national population-based cross-sectional survey, between October and November 2020.","https://www.ncbi.nlm.nih.gov/pmc/articles/PMC8897837/","Included","Journal Article (Peer-Reviewed)","National","Senegal",NA,NA,"Households in all areas of Senegal.","Hemolytic and under-filled blood samples were excluded from the serological analysis.","All","2020-10-25","2020-11-26","Household and community samples","Multiple groups",1422,0.284,0.261,0.308,"Simplified probability","Omega diagnostics COVID-19 IgG ELISA,Wantai SARS-CoV-2 Total Ab ELISA","Generic Diagnostics Ltd,Beijing Wantai Biological","ELISA","['IgG', 'TotalAntibody']","['Nucleocapsid(N-protein)', 'Spike']","Multiple tests with diff validations or values derived from each type",NA,NA
"Eric Vos","Nationwide seroprevalence of SARS-CoV-2 and identification of risk factors in the general population of the Netherlands during the first epidemic wave","https://dx.doi.org/10.1136/jech-2020-215678","Included","Journal Article (Peer-Reviewed)","National","Netherlands",NA,NA,"Participants who had taken part in a large-scale nationwide serosurveillance study (PIENTER-3) in 2016/2017 from low vaccination coverage municipalities",NA,"All","2020-03-31","2020-05-11","Household and community samples","Multiple groups",570,0.029,0.014,0.063,"Stratified probability","Not reported/ Unable to specify",NA,"ELISA","IgG","Spike","Validated by independent authors/third party/non-developers",0.844,0.99
"Helen Ward","Declining prevalence of antibody positivity to SARS-CoV-2: a community study of 365,000 adults","https://www.medrxiv.org/content/10.1101/2020.10.26.20219725v1.full.pdf","Included","Journal Article (Peer-Reviewed)","National","UK",NA,NA,"Invitations were sent to named individuals randomly selected from the NHS patient list which includes anyone registered with a General Practitioner in England and covers almost the entire
population.",NA,"All","2020-06-20","2020-07-13","Household and community samples","Multiple groups",99908,0.0596,0.0578,0.0614,"Simplified probability","Coronavirus Antibody Rapid Test","Fortress Diagnostics","LFIA","IgG","Spike","Validated by independent authors/third party/non-developers",0.844,0.986
"Laura Espenhain","Prevalence of SARS-CoV-2 antibodies in Denmark: nationwide, population-based seroepidemiological study.","https://dx.doi.org/10.1007/s10654-021-00796-8","Included","Journal Article (Peer-Reviewed)","National","Denmark",NA,NA,"For DSS-I, adults aged 18 years and older with an address in one of 30 municipalities which had a test facility (see below) at that time (n = 5), or were neighbouring a municipality with a test facility (n = 25) were eligible (approximately 45% of the population of Denmark). For DSS-II and DSS-III, people aged 12 years or older were selected by random sampling, with no restriction on municipality (n = 98). To make it a safe experience for children and motivate participation, parents living on the same address as invited children 12–17 years old, were also invited to have an antibody test. Parents’ antibody test results were not included in the seroprevalence calculation.",NA,"All","2020-08-15","2020-09-30","Household and community samples","Multiple groups",11478,0.02,0.017,0.024,"Simplified probability","Wantai SARS-CoV-2 Total Ab ELISA","Beijing Wantai Biological","ELISA","TotalAntibody",NA,"Validated by independent authors/third party/non-developers",0.967,0.995
"Luisa Castro","Prevalence of SARS-CoV-2 Antibodies after First 6 Months of COVID-19 Pandemic, Portugal","https://wwwnc.cdc.gov/eid/article/27/11/21-0636_article","Included","Journal Article (Peer-Reviewed)","National","Portugal",NA,NA,"Resident of Portugal",NA,"All","2020-09-08","2020-10-14","Household and community samples","Multiple groups",13398,0.022,0.02,0.025,"Convenience","ADVIA Centaur Immunoassay System","Siemens","CLIA","TotalAntibody","Spike","Validated by independent authors/third party/non-developers",0.981,0.999
"Manoj V Murhekar","SARS-CoV-2 antibody seroprevalence in India, August-September, 2020: findings from the second nationwide household serosurvey","https://dx.doi.org/10.1016/S2214-109X(20)30544-1","Included","Journal Article (Peer-Reviewed)","National","India",NA,NA,"We did a second household serosurvey among individuals aged 10 years or older in the same 700 villages or wards within 70 districts in India that were included in the first serosurvey.","Individuals aged younger than 10 years and households that did not respond at the time of survey were excluded.","All","2020-08-18","2020-09-20","Household and community samples","Multiple groups",29082,0.066,0.058,0.074,"Stratified probability","Abbott Architect SARS-CoV-2 IgG","Abbott Laboratories","CLIA","IgG","Nucleocapsid(N-protein)","Validated by independent authors/third party/non-developers",1,0.996
"Pablo Vial","Seroprevalence, spatial distribution, and social determinants of SARS-CoV-2 in three urban centers of Chile.","https://dx.doi.org/10.1186/s12879-022-07045-7","Included","Journal Article (Peer-Reviewed)","National","Chile","Coquimbo, Talca, Santiago",NA,"Residents (aged 7 years and older) of 3 urban areas in the center zone of Chile (Greater Santiago, Coquimbo-La Serena, Talca)",NA,"All","2020-09-25","2020-11-25","Household and community samples","Multiple groups",2493,0.104,0.078,0.137,"Stratified probability","Elecsys® Anti‐SARS‐CoV‐2 (S),2019-nCoV IgG/IgM Antibody Detection Kit","Roche Diagnostics,Zhuhai Livzon Diagnostics Inc","Multiple Types","['IgG', 'IgM']","Spike","Multiple tests with diff validations or values derived from each type",NA,NA
"Patrick Sullivan","Severe Acute Respiratory Syndrome Coronavirus 2 Cumulative Incidence, United States, August 2020–December 2020","https://dx.doi.org/10.1093/cid/ciab626","Included","Journal Article (Peer-Reviewed)","National","US",NA,NA,"household members aged >= 18 years old",NA,"All","2020-08-09","2020-12-08","Household and community samples","Multiple groups",4654,0.0471,0.033,0.0611,"Stratified probability","Platelia SARS-CoV-2 Total Ab assay","Bio-rad","ELISA","TotalAntibody","Nucleocapsid(N-protein)","Validated by independent authors/third party/non-developers",0.98,0.993
"Xuyang Tang","Assessment of SARS-CoV-2 Seropositivity During the First and Second Viral Waves in 2020 and 2021 Among Canadian Adults.","https://dx.doi.org/10.1001/jamanetworkopen.2021.46798","Included","Journal Article (Peer-Reviewed)","National","Canada","New Brunswick, Newfoundland, Nova Scotia, and Prince Edward Island, British Columbia, some Yukon Territory, Alberta, Saskatchewan, Manitoba, some Northwest Territories, Ontario, Quebec",NA,"members of the Angus Reid Forum (nationwide polling panel of Canadian adults 18 years and older)","Incomplete test results","All","2020-05-01","2020-09-30","Household and community samples","Multiple groups",8967,0.019,NA,NA,"Convenience","Author designed (ELISA) -Spike",NA,"ELISA","IgG","Spike","Validated by developers",0.98,NA
"Zhongjie Li","Antibody seroprevalence in the epicenter Wuhan, Hubei, and six selected provinces after containment of the first epidemic wave of COVID-19 in China","https://dx.doi.org/10.1016/j.lanwpc.2021.100094","Included","Journal Article (Peer-Reviewed)","National","China",NA,NA,"Eligible participants were over one year old who lived in the surveyed areas for at least 14 days during the epidemic period (December 2019 to March 2020)",NA,"All","2020-04-10","2020-04-18","Household and community samples","Multiple groups",34857,0.0123,NA,NA,"Stratified probability","Finecare SARS-CoV-2 Antibody test,2019-nCoV IgG Rapid Test,Magnetic Chemiluminescence Enzyme Immunoassay Kit,Author designed (Neutralization Assay)","Guangzhou Wondfo Biotech Co. Ltd,Innovita Biological Technology Co. Ltd,Bioscience Diagnostics,NA","Multiple Types","['IgG', 'IgM', 'Neutralizing', 'TotalAntibody']","['Nucleocapsid(N-protein)', 'Spike']","Multiple tests with diff validations or values derived from each type",NA,NA
"Evelin Garay","SARS-CoV-2 in eight municipalities of the Colombian tropics: high immunity, clinical and sociodemographic outcomes.","https://dx.doi.org/10.1093/trstmh/trab094","Included","Journal Article (Peer-Reviewed)","Regional","Colombia","Cordoba Department",NA,"Eight municipalities with the largest populations were chosen between July and November 2020; blood samples were taken from people distributed proportionally from the total population of the eight selected municipalities",NA,"All","2020-07-15","2020-11-15","Household and community samples","Multiple groups",2564,0.408,NA,NA,"Stratified non-probability","INgezim COVID 19 DR","Eurofins Ingenasa","ELISA","['IgA', 'IgG', 'IgM']","Nucleocapsid(N-protein)","Validated by developers",NA,NA
"Maryam Shakiba","Seroprevalence of SARS-CoV-2 in Guilan Province, Iran, April 2020","https://dx.doi.org/10.3201/eid2702.201960","Included","Journal Article (Peer-Reviewed)","Regional","Iran","Guilan",NA,"All persons living in a household, regardless of age, were invited through multistage cluster random sampling",NA,"All","2020-04-11","2020-04-19","Household and community samples","Multiple groups",528,0.222,0.164,0.285,"Stratified probability","VivaDiag COVID-19 IgM/IgG Rapid Test","VivaChek Biotech (Hangzhou) Co. Ltd","LFIA","['IgG', 'IgM']",NA,"Validated by independent authors/third party/non-developers",0.833,0.99
"OgoChukwu Vincent Okpala","Population seroprevalence of SARS-CoV-2 antibodies in Anambra state, South-East, Nigeria","https://www.sciencedirect.com/science/article/pii/S1201971221005968","Included","Journal Article (Peer-Reviewed)","Regional","Nigeria","Anambra State",NA,"For each selected health facility , all clients (≥ one year of age) and health staff were eligible for the survey.","Clients and staff that declined consent were excluded from the study.","All","2020-12-08","2020-12-15","Household and community samples","Multiple groups",3142,0.1607,NA,NA,"Stratified probability","Realy-Tech 2019 nCOV/COVID-19 IgG/IgM Rapid Test","Hangzhou Realy Tech Co. Ltd","LFIA","['IgG', 'IgM']",NA,"Validated by manufacturers",0.98,0.99
"Cristian Diaz Velez","SARS-CoV-2 seroprevalence study in Lambayeque, Peru. June-July 2020","https://dx.doi.org/10.7717/peerj.11210","Included","Journal Article (Peer-Reviewed)","Regional","Peru","Lambayeque Province",NA,"Population of the Lambayeque region","People who had previously had a diagnosis of SARS-CoV-2 by RT-PCR or by serological test are excluded","All","2020-06-24","2020-07-10","Household and community samples","Multiple groups",2010,0.295,0.276,0.315,"Stratified probability","Coretests COVID-19 IgM/IgG Ab Test","Core Technology Co. Ltd","LFIA","['IgG', 'IgM']",NA,"Validated by independent authors/third party/non-developers",0.66,0.97
"Aude Richard","Seroprevalence of anti-SARS-CoV-2 IgG antibodies, risk factors for infection and associated symptoms in Geneva, Switzerland: a population-based study","https://www.medrxiv.org/content/10.1101/2020.12.16.20248180v1.full-text","Included","Journal Article (Peer-Reviewed)","Regional","Switzerland","Canton of Geneva",NA,"SEROCoV-POP is a population-based repeated cross-sectional observational seroprevalence study. We recruited participants between 6 April and 30 June 2020. The recruitment strategy and serological data collection have previously been described in detail [4]. Briefly, participants were invited progressively by email and postal mail from the study population of a yearly health survey called Bus Santé [19], which is representative of the 20–74-year-old population of canton Geneva. Participants were invited to bring members of their household aged 5 years and older.",NA,"All","2020-04-06","2020-06-30","Household and community samples","Multiple groups",8344,0.078,0.068,0.089,"Simplified probability","Anti-SARS-CoV-2 ELISA IgG","EUROIMMUN","ELISA","IgG","Spike","Validated by independent authors/third party/non-developers",0.93,1
"Kene Nwosu","SARS-CoV-2 antibody seroprevalence and associated risk factors in an urban district in Cameroon.","https://dx.doi.org/10.1038/s41467-021-25946-0","Included","Journal Article (Peer-Reviewed)","Local","Cameroon","Centre","Yaoundé","In each household, all individuals between five and 80 years of age were included if they (a) had been present in the household for at least 14 days prior to the survey, and (b) could give written informed consent (or had an adult guardian who could give consent).",NA,"All","2020-10-14","2020-11-26","Household and community samples","Multiple groups",971,0.292,0.238,0.349,"Simplified probability","Panbio COVID-19 IgG/IgM rapid test device","Abbott Laboratories","LFIA","IgG","Nucleocapsid(N-protein)","Validated by independent authors/third party/non-developers",0.915,0.935
"Claudia Santos Hovener","Serology- and PCR-based cumulative incidence of SARS-CoV-2 infection in adults in a successfully contained early hotspot (CoMoLo study), Germany, May to June 2020","https://dx.doi.org/10.2807/1560-7917.ES.2020.25.47.2001752","Included","Journal Article (Peer-Reviewed)","Local","Germany","Baden-Württemberg","Kupferzell","A random sample of 3,534 Kupferzell residents aged 18
years and older from the mandatory population registry
(68.9% of the 5,128 adult residents) was invited to take
part in the study,",NA,"All","2020-05-20","2020-06-09","Household and community samples","Multiple groups",2203,0.12,0.104,0.14,"Simplified probability","Anti-SARS-CoV-2 ELISA IgG","EUROIMMUN","ELISA","IgG","Spike","Validated by independent authors/third party/non-developers",0.883,0.992
"Abou Soumah","High and Rapid Increase in Seroprevalence for SARS-CoV-2 in Conakry, Guinea: Results From 3 Successive Cross-Sectional Surveys (ANRS COV16-ARIACOV).","https://dx.doi.org/10.1093/ofid/ofac152","Included","Journal Article (Peer-Reviewed)","Local","Guinea",NA,"Conakry","Gen pop of Conakry",NA,"All","2020-12-02","2020-12-26","Household and community samples","Multiple groups",535,0.173,0.124,0.238,"Stratified non-probability","xMAP® SARS‑CoV‑2 Multi-Antigen IgG Assay","Luminex Corporation","Luminex","IgG","['Nucleocapsid(N-protein)', 'Spike']","Validated by independent authors/third party/non-developers",NA,0.997
"Laura Heavey","The Study to Investigate COVID-19 Infection in People Living in Ireland (SCOPI): A seroprevalence study, June to July 2020.","https://dx.doi.org/10.2807/1560-7917.ES.2021.26.48.2001741","Included","Journal Article (Peer-Reviewed)","Local","Ireland",NA,NA,"we selected random samples of people in each of two defined geographic areas, counties Dublin (population aged 12–69 years: n=1,021,801) and Sligo (population aged 12–69 years: n=47,718), which have high and low incidence of notified COVID-19 cases, respectively, which together represent 30% of the national population in this age group. Within age–sex strata, we selected participants using simple random sampling.","We excluded those 
under 12 years as phlebotomy is difficult in young children, and people aged 70 and older as they had been advised to stay at home during this study period.","All","2020-06-22","2020-07-16","Household and community samples","Multiple groups",913,0.0312,0.0205,0.0453,"Simplified probability","Abbott Architect SARS-CoV-2 IgG,Wantai SARS-CoV-2 Total Ab ELISA","Abbott Laboratories,Beijing Wantai Biological","Multiple Types","['IgG', 'TotalAntibody']","['Nucleocapsid(N-protein)', 'Spike']","Multiple tests with diff validations or values derived from each type",NA,NA
"Gabriele Pagani","Prevalence of SARS-CoV-2 in an area of unrestricted viral circulation: Mass seroepidemiological screening in Castiglione d'Adda, Italy","https://dx.doi.org/10.1371/journal.pone.0246513","Included","Journal Article (Peer-Reviewed)","Local","Italy","Lombardy","Castiglione D’Adda","Entire population of the town of Castiglione D'Adda","Did not consent to participate","All","2020-05-18","2020-06-07","Household and community samples","Multiple groups",4143,0.222,NA,NA,"Entire sample","PRIMA COVID-19 IgG/IgM Rapid Test","PRIMA Lab S.A.","LFIA","IgG",NA,"Validated by independent authors/third party/non-developers",1,0.96
"Isaac Ngere","High seroprevalence of SARS-CoV-2 but low infection fatality ratio eight months after introduction in Nairobi, Kenya","https://dx.doi.org/10.1016/j.ijid.2021.08.062","Included","Journal Article (Peer-Reviewed)","Local","Kenya",NA,NA,"Consenting residents in selected households (irrespective of age) who had lived in the city for at least six months preceding the survey were enrolled","Persons with reported or documented contraindications to venipuncture were excluded.","All","2020-11-02","2020-11-23","Household and community samples","Multiple groups",1164,0.347,0.318,0.376,"Simplified probability","Wantai SARS-CoV-2 Total Ab ELISA","Beijing Wantai Biological","ELISA","['IgG', 'IgM']",NA,"Validated by manufacturers",0.944,1
"Raheema Abdul-Raheem","A sero-epidemiological study after two waves of the COVID-19 epidemic.","https://apjai-journal.org/wp-content/uploads/2022/01/AP-040721-1177.pdf","Included","Journal Article (Peer-Reviewed)","Local","Maldives",NA,"Male'","The study population were the people living in Male’ at the time of survey.",NA,"All","2020-10-15","2020-11-16","Household and community samples","Multiple groups",1940,0.134,NA,NA,"Stratified probability","VITROS Immunodiagnostic Products Anti-SARS-CoV-2 Total","Ortho Clinical Diagnostics Inc.","CLIA","TotalAntibody","Spike","Validated by independent authors/third party/non-developers",0.9,1
"Muhammed Imran Nisar","Serial population-based serosurveys for COVID-19 in two neighbourhoods of Karachi, Pakistan","http://dx.doi.org/10.1016/j.ijid.2021.03.040","Included","Journal Article (Peer-Reviewed)","Local","Pakistan","Karachi","District East","all household members were eligible to participate regardless of their infectious status","Facilities such as hospitals, care homes, educational institutions and prison were excluded. However, healthcare workers within a household were not excluded.","All","2020-04-15","2020-04-25","Household and community samples","Multiple groups",500,0.004,0,0.013,"Simplified probability","Elecsys® Anti‐SARS‐CoV‐2 (N)","Roche Diagnostics","CLIA","['IgG', 'IgM']",NA,"Validated by manufacturers",1,0.998
